{
    "$schema": "../../../static/schemas/sections/locale.json",
    "language": "ja",
    "regions": ["JP"],
    "guidance": "",
    "glossary": {
        "wordplay": {
            "word": "Wordplay",
            "definition": "$~このプラットフォームと、このプラットフォームでプロジェクトを作るために使うプログラミング@languageです。"
        },
        "value": {
            "word": "$~値",
            "definition": "$~@Numberやいくつかの言葉、@Listのような情報のかたまりです。"
        },
        "type": {
            "word": "$~型",
            "definition": "$~@Numberや@Textのような、@valueの種類です。値の型によって、それでできることが決まります。"
        },
        "expression": {
            "word": "$~式",
            "definition": "$~実行すると@valueを作る@codeの一部です。"
        },
        "variable": {
            "word": "$~変数",
            "definition": "$~@Programが動いている間に@valueが変わることのできる@nameです。"
        },
        "parameter": {
            "word": "$~パラメーター",
            "definition": "$~@FunctionDefinitionを呼び出すときに求められる、名前のついた@Inputです。"
        },
        "argument": {
            "word": "$~引数",
            "definition": "$~@FunctionDefinitionの@parametersの一つのために渡す@valueです。"
        },
        "operator": {
            "word": "$~演算子",
            "definition": "$~+ や - のように、値を組み合わせたり比べたりする記号。"
        },
        "condition": {
            "word": "$~条件",
            "definition": "$~@Programが次に何をするかを決める、真か偽かのテストです。"
        },
        "loop": {
            "word": "$~ループ",
            "definition": "$~ある動作を何度も繰り返す@codeです。"
        },
        "iteration": {
            "word": "$~繰り返し",
            "definition": "$~@loopを一回通ることです。"
        },
        "recursion": {
            "word": "$~再帰",
            "definition": "$~問題の小さな部分を扱うために、@FunctionDefinitionが自分自身を呼び出すことです。"
        },
        "property": {
            "word": "$~プロパティ",
            "definition": "$~@Colorの明るさのような、@valueの名前のついた部分です。"
        },
        "element": {
            "word": "$~要素",
            "definition": "$~@Listやグループの中の一つの項目です。"
        },
        "scope": {
            "word": "$~スコープ",
            "definition": "$~@nameを使うことのできる、@Programの部分です。"
        },
        "state": {
            "word": "$~状態",
            "definition": "$~@Programが持ち続け、時間とともに変えることのできる情報です。"
        },
        "sideEffect": {
            "word": "$~副作用",
            "definition": "$~@Programが@valueを返す以外に加える変化のことです。例えば@Outputを表示することです。"
        },
        "abstraction": {
            "word": "$~抽象化",
            "definition": "$~中でどう動くか知らなくても使えるように、細かい部分を隠すこと。"
        },
        "project": {
            "word": "$~プロジェクト",
            "definition": "$~一つの@wordplay@Programを作るすべてのファイルです。"
        },
        "code": {
            "word": "$~コード",
            "definition": "$~@Programに何をするかを伝えるために書く文章です。"
        },
        "act": {
            "word": "$~幕",
            "definition": "$~@tutorialの大きな部分で、劇の幕のようなものです。"
        },
        "how": {
            "word": "$~やり方ガイド",
            "definition": "$~一つのことのやり方を示す短い@guideです。"
        },
        "gallery": {
            "word": "$~ギャラリー",
            "definition": "$~みんながプロジェクトを共有したり見て回ったりする場所。"
        },
        "blocks": {
            "word": "$~ブロック",
            "definition": "$~入力する代わりに部品をドラッグして@codeを編集する方法です。"
        },
        "placeholder": {
            "word": "$~プレースホルダー",
            "definition": "$~@codeや@valueが足りない場所を示す空いた場所です。"
        },
        "conflict": {
            "word": "$~衝突",
            "definition": "$~@wordplayが印をつけて直せるようにする、@codeの中の問題です。"
        },
        "checkpoint": {
            "word": "$~チェックポイント",
            "definition": "$~作業の中で戻れる、保存された地点。"
        },
        "guide": {
            "word": "$~ガイド",
            "definition": "$~@wordplayの考え方を説明する、検索できる参照資料。"
        },
        "tutorial": {
            "word": "$~チュートリアル",
            "definition": "$~@wordplayを教える、一歩ずつのレッスン。"
        },
        "name": {
            "word": "$~名前",
            "definition": "$~@valueや@FunctionDefinitionを指す言葉です。"
        },
        "markup": {
            "word": "$~マークアップ",
            "definition": "$~太字の言葉やリンクのような、書式のついた文章です。"
        },
        "language": {
            "word": "$~言語",
            "definition": "$~@nameやテキストを書くための人間の言語。"
        },
        "documentation": {
            "word": "$~ドキュメント",
            "definition": "$~@codeが何をするかを説明するテキスト。"
        },
        "region": {
            "word": "$~地域",
            "definition": "$~@languageが使われる場所。数字や日付の見え方が変わることがあります。"
        },
        "start": {
            "word": "$~開始",
            "definition": "$~@projectが始まる、主なソースファイル。"
        },
        "query": {
            "word": "$~クエリ",
            "definition": "$~@Tableから行を選ぶ方法。"
        },
        "key": {
            "word": "$~キー",
            "definition": "$~@Mapの中で項目を見つけるために使う@value。"
        },
        "index": {
            "word": "$~インデックス",
            "definition": "$~@Listの中の位置で項目を選ぶ@Number。"
        },
        "moved": {
            "word": "$~移動",
            "definition": "$~ステージ上で位置が変わった@Output。"
        },
        "entered": {
            "word": "$~新規",
            "definition": "$~ステージ上に初めて現れた@Output。"
        },
        "cell": {
            "word": "$~セル",
            "definition": "$~@Tableの行の中の1つの@value。"
        },
        "column": {
            "word": "$~列",
            "definition": "$~@Tableの中の名前付きフィールド。"
        },
        "editor": {
            "word": "$~エディター",
            "definition": "$~@codeを書く場所です。そこに書いたものを@wordplayが実行します。"
        },
        "stage": {
            "word": "$~ステージ",
            "definition": "$~@codeが作ったものを@wordplayが表示する場所です。"
        },
        "stream": {
            "word": "$~ストリーム",
            "definition": "$~世界の変化に合わせて、時間とともに変わっていく@valueです。たとえば、@Timeが刻まれたり、@Keyが押されたりすることです。値が変わるたびに、@Programは新しい@valueでもう一度評価されます。"
        },
        "source": {
            "word": "$~ソース",
            "definition": "$~@projectの中にある1つの@codeドキュメント。1つの@projectは複数持つことができ、それぞれが他のものが@borrowものを@shareことができます。"
        },
        "borrow": {
            "word": "$~借りる",
            "definition": "$~↓とその@sourceの名前を書くことで、他の@Sourceが共有したものを使うことです。"
        },
        "share": {
            "word": "$~共有する",
            "definition": "$~@Sourceの中にあるものに↑を付けて、他の@sourceファイルがそれを@borrowできるようにすることです。"
        },
        "kit": {
            "word": "$~キット",
            "definition": "$~誰かが公開した@Sourceで、他の人が自分の@projectの中でそれを@borrowことができます。"
        }
    },
    "terms": {},
    "moderation": {
        "warning": {
            "header": "$~警告",
            "explanation": "$~管理者は、この内容が次のことをするかもしれないと判断しました:"
        },
        "blocked": {
            "header": "$~ブロック済み",
            "explanation": "$~管理者は、この内容が次のことをするかもしれないと判断しました:"
        },
        "unmoderated": {
            "header": "$~メモ",
            "explanation": "$~この内容はまだ確認されていません。次のことをするかもしれません:"
        },
        "moderate": {
            "header": "$~確認する",
            "explanation": "$~このプロジェクトを見て、その内容が次のどれかをしているか決めてください。もししているなら、内容には警告が付くか、ブロックされます。よく分からない場合は飛ばしてもかまいません。"
        },
        "flags": {
            "violence": "$~だれかへの暴力、危害、または自傷をあおったり、すすめたり、たたえたりする。",
            "dehumanization": "$~人種、民族、出身国、カースト、性的指向、性別、宗教、年齢、能力、または見た目をもとに、個人やグループを人間として扱わない。",
            "disclosure": "$~名前、連絡先、住所など、他の人の個人情報を明かす",
            "misinformation": "$~うそ、まちがった、だます、またはあやつるような情報をふくむ"
        },
        "progress": "$~*$moderated* 件確認済み、*$remaining* 件残り",
        "button": {
            "submit": {
                "tip": "$~これらの確認の設定を保存する",
                "label": "$~保存"
            },
            "skip": {
                "tip": "$~このプロジェクトを飛ばす",
                "label": "$~飛ばす"
            }
        },
        "done": "$~確認するものはもうありません！",
        "error": {
            "notmod": "$~ここには確認するものがありません。Wordplayのモデレーターは公開されているコンテンツを確認し、ギャラリーのキュレーターはそのギャラリー内のものを確認します。最近モデレーターの権限を得た場合は、もう一度ログインする必要があるかもしれません。",
            "unreachable": "$~このキューを読み込めなかったので、何かが待っているかわかりません。少し時間をおいてもう一度試してください。",
            "unreadable": "$~ここには待っているものがありますが、読み込めなかったので表示されません。"
        },
        "report": {
            "button": "$~モデレーターに確認をお願いする",
            "confirm": "$~報告する",
            "sent": "$~モデレーターにこの内容の確認を依頼しました",
            "announce": "$~モデレーターに$project",
            "flagged": "$~このプロジェクトは報告されたので、確認の順番が最初になっています。"
        },
        "strike": {
            "issue": "$~この制作者に警告する",
            "consequence": "$~これは、この作成者にとって $#count[$count回目の警告]です。$banning[この警告により、何かを公開する権限が取り消されます。|$#remaining[あと$remaining回の警告までは公開できます]。]",
            "confirm": {
                "description": "$~この判断を記録し、制作者に警告する",
                "prompt": "$~警告する"
            },
            "banned": "$~あなたは公開コンテンツについてすでに3回警告を受けているため、これ以上プロジェクトやギャラリーを公開することはできません。プロジェクトを作ること自体はでき、選んだ人と共有することもできます。もしこれが間違いだと思う場合や、ずいぶん前のことなのでまた公開したい場合は、hi@wordplay.devに連絡し、ユーザー名と理由を教えてください。",
            "warned": "$~あなたが公開したコンテンツの一部が共有ルールを破ったため、公開されなくなりました。これは$#count[$count]回目の警告です。$#remaining[あと$remaining回で、何も公開できなくなります。]",
            "notification": "$~あなたが公開して共有した内容についての$#count[$count回目]の警告です。"
        },
        "queue": {
            "label": "$~何を確認するか",
            "labels": [
                "$~プロジェクト",
                "$~ギャラリー",
                "$~キット",
                "$~やり方ガイド",
                "$~メッセージ"
            ],
            "tips": [
                "$~みんなが公開したプロジェクトを確認する",
                "$~公開を申し込んでいるギャラリーを確認する",
                "$~ガイドへの掲載を希望しているキットを確認する",
                "$~ガイドへの掲載を求めているやり方ガイドを確認する",
                "$~自分が管理しているギャラリーで報告されたメッセージを確認する"
            ]
        },
        "gallery": {
            "pending": "$~モデレーターが、あなたのギャラリーを公開できるかどうかを確認しています。それまでは、リンクを教えた人だけがそれを見ることができます。",
            "approved": "$~あなたのギャラリーは<公開ギャラリーのページ@://galleries?tab=public>に載っています！これはいつでも、どんな理由でもリストから外されることがあります。",
            "denied": "$~モデレーターは、あなたのギャラリーを公開しないことに決めました。作業を続けて、もう一度公開状態にすれば、再び申し込むことができます。",
            "explain": "$~このギャラリーは公開を申し込んでいます。ギャラリーとその中のプロジェクトを見て、みんなに見せられるくらい完成しているかどうかを決めてください。",
            "done": "$~決定を待っているギャラリーはありません。ありがとうございます！",
            "approve": {